{
  "ticket_key": "223",
  "branch": "soda/223",
  "commits": [
    {
      "hash": "a1b2c3d",
      "message": "chore: add soda-simple fixture with SODA-schema phase files [#223]",
      "task_id": "T1"
    },
    {
      "hash": "e4f5a6b",
      "message": "chore: add soda_simple_dir conftest fixture and integration tests [#223]",
      "task_id": "T3"
    }
  ],
  "files_changed": [
    {"path": "tests/fixtures/sessions/soda-simple/meta.json",       "action": "created"},
    {"path": "tests/fixtures/sessions/soda-simple/events.jsonl",    "action": "created"},
    {"path": "tests/fixtures/sessions/soda-simple/triage.json",     "action": "created"},
    {"path": "tests/fixtures/sessions/soda-simple/plan.json",       "action": "created"},
    {"path": "tests/fixtures/sessions/soda-simple/implement.json",  "action": "created"},
    {"path": "tests/fixtures/sessions/soda-simple/verify.json",     "action": "created"},
    {"path": "tests/fixtures/sessions/soda-simple/review.json",     "action": "created"},
    {"path": "tests/conftest.py",                                   "action": "modified"},
    {"path": "tests/test_adapters.py",                              "action": "modified"}
  ],
  "task_results": [
    {"task_id": "T1", "status": "completed"},
    {"task_id": "T2", "status": "completed"},
    {"task_id": "T3", "status": "completed"}
  ],
  "tests_passed": true,
  "test_output": "5 passed in 0.12s"
}
